<?xml version="1.0" encoding="UTF-8"?>
<xsd:schema xmlns:xsd="http://www.w3.org/2001/XMLSchema"
           targetNamespace="https://www.w3schools.com"
           xmlns="https://www.w3schools.com"
           elementFormDefault="qualified">
    <xsd:element name="facultySoftwareDatabase" type="facultySoftwareDatabaseType"/>
<xsd:complexType name="facultySoftwareDatabaseType">
    <xsd:sequence>
        <xsd:element name="software" minOccurs="1" maxOccurs="unbounded">
            <xsd:complexType>
                <xsd:sequence>
                    <xsd:element name="type" type="xsd:string"/>
                    <xsd:element name="author" type="xsd:string"/>
                    <xsd:element name="license" type="xsd:string"/>
                </xsd:sequence>
                <xsd:attribute name="name" type="xsd:string"/>
                <xsd:attribute name="description" type="xsd:string"/>
                <xsd:attribute name="version" type="xsd:string"/>
            </xsd:complexType>
        </xsd:element>
    </xsd:sequence>
</xsd:complexType>
</xsd:schema>